{
  "$schema": "https://json-schema.org/draft/2020-12/schema",
  "$id": "https://kappa-box.invalid/schemas/landlock-capability.schema.json",
  "title": "kappa-box Landlock capability record v1",
  "description": "Read-only Landlock ABI observation. This record never writes facts, pins, or profile acceptance.",
  "type": "object",
  "additionalProperties": false,
  "required": [
    "profileId",
    "collectedAt",
    "acceptance",
    "probeStatus",
    "probeSuiteVersion",
    "sourceCommit",
    "facts",
    "factsDigest",
    "pins",
    "failureGroups",
    "capability",
    "commands"
  ],
  "properties": {
    "profileId": {
      "type": "string",
      "const": "wsl2:l1@openshell-docker"
    },
    "collectedAt": {
      "type": "string",
      "format": "date-time",
      "pattern": "^\\d{4}-\\d{2}-\\d{2}T\\d{2}:\\d{2}:\\d{2}(?:\\.\\d+)?(?:Z|[+-]\\d{2}:\\d{2})$"
    },
    "acceptance": {
      "const": "unverified"
    },
    "probeStatus": {
      "const": "landlock_capability"
    },
    "probeSuiteVersion": {
      "type": "string",
      "minLength": 1,
      "maxLength": 128
    },
    "sourceCommit": {
      "type": "string",
      "minLength": 1,
      "maxLength": 128
    },
    "facts": { "type": "null" },
    "factsDigest": { "type": "null" },
    "pins": { "type": "null" },
    "failureGroups": {
      "type": "array",
      "maxItems": 1,
      "items": { "const": "landlock" }
    },
    "capability": {
      "type": "object",
      "additionalProperties": false,
      "required": ["status", "abiVersion", "error"],
      "properties": {
        "status": {
          "enum": ["supported", "unsupported", "unreadable"]
        },
        "abiVersion": {
          "type": ["integer", "null"],
          "minimum": 1
        },
        "error": {
          "type": ["string", "null"],
          "minLength": 1
        }
      }
    },
    "commands": {
      "type": "array",
      "minItems": 1,
      "maxItems": 1,
      "items": {
        "type": "object",
        "additionalProperties": false,
        "required": [
          "name",
          "argv",
          "returncode",
          "timed_out",
          "truncated"
        ],
        "properties": {
          "name": { "type": "string", "minLength": 1, "maxLength": 128 },
          "argv": {
            "type": "array",
            "minItems": 1,
            "items": { "type": "string", "maxLength": 4096 }
          },
          "returncode": { "type": "integer" },
          "stdout": { "type": "string" },
          "stderr": { "type": "string" },
          "duration_ms": { "type": "integer", "minimum": 0 },
          "timed_out": { "type": "boolean" },
          "truncated": { "type": "boolean" }
        }
      }
    }
  },
  "allOf": [
    {
      "if": {
        "properties": {
          "capability": {
            "properties": { "status": { "const": "supported" } },
            "required": ["status"]
          }
        },
        "required": ["capability"]
      },
      "then": {
        "properties": {
          "failureGroups": { "maxItems": 0 },
          "capability": {
            "properties": {
              "abiVersion": { "type": "integer", "minimum": 1 },
              "error": { "type": "null" }
            }
          }
        }
      },
      "else": {
        "properties": {
          "failureGroups": {
            "minItems": 1,
            "contains": { "const": "landlock" }
          },
          "capability": {
            "properties": {
              "abiVersion": { "type": "null" },
              "error": { "type": "string", "minLength": 1 }
            }
          }
        }
      }
    }
  ]
}
